{
  "schema_version": "herdr-dashboard-projection/1.3",
  "task_id": "RUN-20260918-QR-ANDROID",
  "subject_revision": "sha256:34ff8fac1e19d73225ca0ac395fa82c1504457977de953df0ddeb95cf22f29a3",
  "ingestion_status": "VALID",
  "evidence_status": "NOT_READY",
  "acceptance_status": "UNVERIFIED",
  "criteria": [
    {
      "criterion_id": "DEVICE_EVIDENCE",
      "required": true,
      "status": "UNVERIFIED",
      "generation": null,
      "selected_event_id": null,
      "superseded_event_ids": [],
      "evidence_refs": ["LEGACY:QR-ANDROID-01-D01"],
      "reason_codes": ["DEVICE_EVIDENCE_PENDING"]
    }
  ],
  "diagnostics": [
    {
      "source_ref": "herdr-team/.agent-control/EVIDENCE/QR-ANDROID-01-D01.json",
      "code": "SUBMISSION_NOT_READY"
    }
  ],
  "generated_from_event_digest": "d2c124f3b5a2380326085dc62717b8b2e82a1953c26559a66b7c3b58b6e66a9a",
  "reducer_version": "shadow-reducer/1.0"
}
